{
  "$schema": "http://json-schema.org/draft-07/schema#",
  "$id": "https://github.com/iDiagoValeta/automated-news/schema/digest.schema.json",
  "title": "Digest diario de La Terminal",
  "type": "object",
  "additionalProperties": false,
  "required": ["date", "generated_at", "provider", "items"],
  "properties": {
    "date": {
      "type": "string",
      "format": "date",
      "description": "Fecha de la edicion en formato YYYY-MM-DD (zona Europe/Madrid)."
    },
    "generated_at": {
      "type": "string",
      "format": "date-time",
      "description": "Instante de generacion en ISO 8601 UTC."
    },
    "provider": {
      "type": "string",
      "enum": ["deepseek", "claude-code"]
    },
    "items": {
      "type": "array",
      "minItems": 8,
      "maxItems": 20,
      "items": {
        "type": "object",
        "additionalProperties": false,
        "required": ["rank", "category", "title", "summary", "why_it_matters", "url", "source"],
        "properties": {
          "rank": {
            "type": "integer",
            "minimum": 1,
            "maximum": 20
          },
          "category": {
            "type": "string",
            "enum": ["lanzamientos", "investigacion", "industria", "herramientas"]
          },
          "title": {
            "type": "string",
            "minLength": 1,
            "maxLength": 200
          },
          "summary": {
            "type": "string",
            "minLength": 1,
            "maxLength": 800
          },
          "why_it_matters": {
            "type": "string",
            "minLength": 1,
            "maxLength": 400
          },
          "url": {
            "type": "string",
            "format": "uri",
            "pattern": "^https?://"
          },
          "source": {
            "type": "string",
            "minLength": 1
          },
          "social": {
            "type": "object",
            "additionalProperties": false,
            "required": ["x", "linkedin"],
            "properties": {
              "x": { "type": "string", "minLength": 1, "maxLength": 600 },
              "linkedin": { "type": "string", "minLength": 1, "maxLength": 3000 }
            }
          }
        }
      }
    },
    "repos": {
      "type": "array",
      "maxItems": 8,
      "description": "Seccion 'Repositorios hot'; opcional, se rellena tras la validacion.",
      "items": {
        "type": "object",
        "additionalProperties": false,
        "required": ["name", "url", "description"],
        "properties": {
          "name": { "type": "string", "minLength": 1 },
          "url": { "type": "string", "format": "uri", "pattern": "^https?://" },
          "description": { "type": "string", "minLength": 1, "maxLength": 400 },
          "language": { "type": "string" },
          "stars": { "type": "integer", "minimum": 0 },
          "social": {
            "type": "object",
            "additionalProperties": false,
            "required": ["x", "linkedin"],
            "properties": {
              "x": { "type": "string", "minLength": 1, "maxLength": 600 },
              "linkedin": { "type": "string", "minLength": 1, "maxLength": 3000 }
            }
          }
        }
      }
    },
    "lecturas": {
      "type": "array",
      "maxItems": 10,
      "description": "Seccion 'Lecturas'; opcional, se rellena tras la validacion.",
      "items": {
        "type": "object",
        "additionalProperties": false,
        "required": ["title", "url", "source", "summary", "tema"],
        "properties": {
          "title": { "type": "string", "minLength": 1, "maxLength": 200 },
          "url": { "type": "string", "format": "uri", "pattern": "^https?://" },
          "source": { "type": "string", "minLength": 1 },
          "summary": { "type": "string", "minLength": 1, "maxLength": 600 },
          "tema": {
            "type": "string",
            "enum": ["programacion", "ia", "web", "datos", "arquitectura", "diseno", "carrera"]
          }
        }
      }
    }
  }
}
