{
  "date": "2026-09-23",
  "generated_at": "2026-09-23T15:00:21.840Z",
  "provider": "deepseek",
  "items": [
    {
      "rank": 1,
      "category": "lanzamientos",
      "title": "OpenAI lanza GPT-6 Sol y Luna, dos modelos que recortan el precio a la mitad",
      "summary": "OpenAI ha presentado GPT-6 Sol y GPT-6 Luna, dos modelos que llevan inteligencia de frontera al trabajo diario con equilibrios distintos entre capacidad y coste. Sol apunta a la máxima calidad y Luna a la eficiencia, y ambos rebajan el precio por token frente a sus predecesores. Ya están disponibles en la API y en Amazon Bedrock.",
      "why_it_matters": "Dos modelos nuevos a mitad de precio cambian de golpe el cálculo de coste de cualquier producto construido sobre la API.",
      "url": "https://openai.com/index/introducing-gpt-6-sol-and-luna",
      "source": "OpenAI News",
      "social": {
        "x": "OpenAI parte GPT-6 en dos, Sol y Luna, y baja a la mitad el precio por token. Uno va a por la máxima calidad; el otro, a la eficiencia. Ya están en la API.\n\n#OpenAI #GPT6 #AmazonBedrock #API\nhttps://openai.com/index/introducing-gpt-6-sol-and-luna",
        "linkedin": "El coste por token deja de ser la excusa. OpenAI parte su modelo de frontera en dos, GPT-6 Sol y GPT-6 Luna, y 𝗿𝗲𝗯𝗮𝗷𝗮 𝗮 𝗹𝗮 𝗺𝗶𝘁𝗮𝗱 𝗲𝗹 𝗽𝗿𝗲𝗰𝗶𝗼 𝗱𝗲 𝗹𝗮 𝗶𝗻𝘁𝗲𝗹𝗶𝗴𝗲𝗻𝗰𝗶𝗮 𝗱𝗲 𝗳𝗿𝗼𝗻𝘁𝗲𝗿𝗮. Sol apunta a la máxima calidad y Luna a la eficiencia, y los dos llegan a la vez a la API y a Amazon Bedrock.\n\nPara cualquier equipo con producto montado sobre la API, esto no es una actualización más: cambia la cuenta de explotación de un día para otro. Toca revisar qué llamadas siguen usando el modelo caro cuando Luna haría el trabajo, y qué parte del roadmap de costes conviene rehacer esta misma semana.\n\n#OpenAI #GPT6 #AmazonBedrock #API\n\nhttps://openai.com/index/introducing-gpt-6-sol-and-luna"
      }
    },
    {
      "rank": 2,
      "category": "lanzamientos",
      "title": "Claude Opus 5.5 iguala a Fable 5.1 con un 40 % menos de coste",
      "summary": "Anthropic estrena la generación Opus 5.5, que según la compañía iguala a Claude Fable 5.1 en la mayoría de tareas con un coste de ejecución un 40 % inferior al de Opus 5. Sus benchmarks la sitúan por delante de GPT-6 Astra en buena parte de las pruebas y promete una escritura menos «Claudish». Se esperan Sonnet 5.5 y Haiku 5.5 en las próximas semanas.",
      "why_it_matters": "El modelo tope de Anthropic baja de precio justo cuando OpenAI también recorta, y eso llega directo a la factura de quien los usa.",
      "url": "https://the-decoder.com/claude-opus-5-5-matches-fable-5-1-at-40-percent-lower-cost-as-anthropic-promises-to-fix-claudish-writing",
      "source": "The Decoder",
      "social": {
        "x": "Opus 5.5 cuesta un 40 % menos que Opus 5 y, según Anthropic, rinde igual. No es la única que está recortando precios.\n\n#Anthropic #ClaudeOpus #OpenAI\nhttps://the-decoder.com/claude-opus-5-5-matches-fable-5-1-at-40-percent-lower-cost-as-anthropic-promises-to-fix-claudish-writing",
        "linkedin": "El modelo tope de Anthropic baja de precio un 40 % sin que, sobre el papel, se pierda rendimiento.\n\nOpus 5.5 iguala a Claude Fable 5.1 en la mayoría de tareas y se coloca por delante de GPT-6 Astra en buena parte de los benchmarks, con una escritura menos reconocible como suya. Lo importante no es el modelo en sí, sino el patrón: 𝗹𝗼𝘀 𝗽𝗿𝗲𝗰𝗶𝗼𝘀 𝗱𝗲 𝗹𝗼𝘀 𝗺𝗼𝗱𝗲𝗹𝗼𝘀 𝘁𝗼𝗽𝗲 𝗲𝘀𝘁á𝗻 𝗰𝗮𝘆𝗲𝗻𝗱𝗼 𝗮 𝗹𝗮 𝘃𝗲𝘇 𝗲𝗻 𝗹𝗮𝘀 𝗱𝗼𝘀 𝗰𝗮𝘀𝗮𝘀 𝗾𝘂𝗲 𝗺𝗮𝗿𝗰𝗮𝗻 𝗲𝗹 𝗿𝗶𝘁𝗺𝗼. Si tu producto depende de una API, revisa el coste por tarea antes de tocar la arquitectura, y no fijes la elección de modelo a fuego: Sonnet 5.5 y Haiku 5.5 llegan en semanas.\n\n#Anthropic #ClaudeOpus #OpenAI\n\nhttps://the-decoder.com/claude-opus-5-5-matches-fable-5-1-at-40-percent-lower-cost-as-anthropic-promises-to-fix-claudish-writing"
      }
    },
    {
      "rank": 3,
      "category": "herramientas",
      "title": "GPT-6 mejora el prompt caching con más aciertos y menos latencia",
      "summary": "OpenAI detalla las mejoras de prompt caching de GPT-6: tasas de acierto más altas, nuevas herramientas de diagnóstico, breakpoints explícitos y controles que reducen latencia y coste. Está pensado para cargas con prompts largos y repetidos, como agentes con system prompts extensos.",
      "why_it_matters": "Aprovechar bien la caché es hoy una de las palancas más directas para recortar la factura de una aplicación con prompts largos.",
      "url": "https://openai.com/index/better-prompt-caching-for-gpt-6",
      "source": "OpenAI News",
      "social": {
        "x": "La palanca más barata para recortar la factura de GPT-6 no es cambiar de modelo: es la caché de prompts. Y OpenAI acaba de afinarla.\n\n#OpenAI #GPT6 #PromptCaching\nhttps://openai.com/index/better-prompt-caching-for-gpt-6",
        "linkedin": "Los equipos que construyen agentes gastan buena parte del presupuesto repitiendo el mismo system prompt una y otra vez.\n\nGPT-6 llega con una caché de prompts que acierta más, añade breakpoints explícitos y herramientas de diagnóstico, así que 𝗹𝗮 𝗰𝗮𝗰𝗵é 𝗱𝗲𝗷𝗮 𝗱𝗲 𝘀𝗲𝗿 𝘂𝗻 𝘁𝗿𝘂𝗰𝗼 𝗮𝗿𝘁𝗲𝘀𝗮𝗻𝗮𝗹 𝘆 𝗽𝗮𝘀𝗮 𝗮 𝘀𝗲𝗿 𝘂𝗻𝗮 𝗽𝗶𝗲𝘇𝗮 𝗱𝗲 𝗶𝗻𝗴𝗲𝗻𝗶𝗲𝗿í𝗮 𝗾𝘂𝗲 𝘀𝗲 𝗺𝗶𝗱𝗲. Para quien mantiene prompts largos y estables, eso es coste y latencia que caen sin tocar el modelo. La pregunta interesante ya no es si cachear, sino cuánto de tu prompt es de verdad estable.\n\n#OpenAI #GPT6 #PromptCaching\n\nhttps://openai.com/index/better-prompt-caching-for-gpt-6"
      }
    },
    {
      "rank": 4,
      "category": "lanzamientos",
      "title": "Alibaba lanza Qwen Audio 3.1 y hunde hasta un 95 % el precio del audio",
      "summary": "El equipo Qwen de Alibaba presenta Qwen-Audio-3.1, una familia de cinco modelos para reconocimiento de voz, síntesis de voz e interacción en tiempo real. El modelo ASR mejora el reconocimiento multilingüe y de dialectos y limpia muletillas y repeticiones, mientras que ASR-Next añade identificación de hablantes con marcas de tiempo y detección de emociones y ruido. TTS cubre síntesis multilingüe y los precios caen hasta un 95 %.",
      "why_it_matters": "Cinco modelos de audio mucho más baratos hacen viable integrar voz en productos pequeños sin disparar el coste.",
      "url": "https://the-decoder.com/alibaba-launches-qwen-audio-3-1-with-five-new-models-and-slashes-ai-audio-prices-by-up-to-95-percent",
      "source": "The Decoder",
      "social": {
        "x": "Alibaba acaba de hundir hasta un 95 % el precio de integrar voz en tu producto. Cinco modelos de audio, del reconocimiento al tiempo real.\n\n#Qwen #Alibaba #ASR #TTS\nhttps://the-decoder.com/alibaba-launches-qwen-audio-3-1-with-five-new-models-and-slashes-ai-audio-prices-by-up-to-95-percent",
        "linkedin": "Alibaba acaba de tirar hasta un 95 % el precio de integrar voz en un producto.\n\nQwen-Audio-3.1 llega con cinco modelos: reconocimiento de voz multilingüe y de dialectos, identificación de hablantes con marcas de tiempo, detección de emociones y ruido, y síntesis multilingüe. El ASR además limpia muletillas y repeticiones, un detalle nada menor si vas a transcribir audio real de usuarios. Con estos precios, 𝗺𝗼𝗻𝘁𝗮𝗿 𝘃𝗼𝘇 𝗲𝗻 𝘂𝗻 𝗽𝗿𝗼𝗱𝘂𝗰𝘁𝗼 𝗽𝗲𝗾𝘂𝗲ñ𝗼 𝗱𝗲𝗷𝗮 𝗱𝗲 𝘀𝗲𝗿 𝘂𝗻𝗮 𝗱𝗲𝗰𝗶𝘀𝗶ó𝗻 𝗱𝗲 𝗽𝗿𝗲𝘀𝘂𝗽𝘂𝗲𝘀𝘁𝗼 y pasa a ser una decisión de producto.\n\n#Qwen #Alibaba #ASR #TTS\n\nhttps://the-decoder.com/alibaba-launches-qwen-audio-3-1-with-five-new-models-and-slashes-ai-audio-prices-by-up-to-95-percent"
      }
    },
    {
      "rank": 5,
      "category": "herramientas",
      "title": "Unreal Agent promete ahorrar hasta un 40 % frente a Codex",
      "summary": "Unreal Labs presenta Unreal Agent, un harness de agentes que, según sus propias mediciones, logra hasta un 40 % de ahorro de coste frente a Codex en cargas de producción y en benchmarks de código y ciencia, sin pérdida de rendimiento. La empresa busca socios para llevar esa eficiencia de coste a agentes de frontera.",
      "why_it_matters": "Si el ahorro se confirma, el coste por tarea de los agentes de código cae de forma inmediata y medible.",
      "url": "https://unreallabs.ai/blog/unreal-agent",
      "source": "Hacker News",
      "social": {
        "x": "Un harness de agentes promete recortar un 40 % el coste de Codex en producción. Si se confirma, el precio por tarea de los agentes de código cae ya.\n\n#UnrealAgent #Codex #DevTools\nhttps://unreallabs.ai/blog/unreal-agent",
        "linkedin": "Un harness de agentes promete recortar un 40 % el coste de Codex en producción sin perder rendimiento.\n\nUnreal Agent, de Unreal Labs, se presenta como una capa de orquestación que ataca justo donde más duele ahora: el coste por tarea. Si las mediciones se sostienen en entornos reales y no solo en su propio benchmark, 𝗹𝗮 𝗲𝗳𝗶𝗰𝗶𝗲𝗻𝗰𝗶𝗮 𝗱𝗲𝗷𝗮 𝗱𝗲 𝘀𝗲𝗿 𝘂𝗻 𝗽𝗿𝗼𝗯𝗹𝗲𝗺𝗮 𝗱𝗲 𝗶𝗻𝗳𝗿𝗮𝗲𝘀𝘁𝗿𝘂𝗰𝘁𝘂𝗿𝗮 𝘆 𝗽𝗮𝘀𝗮 𝗮 𝘀𝗲𝗿 𝘂𝗻 𝗰𝗿𝗶𝘁𝗲𝗿𝗶𝗼 𝗱𝗲 𝗰𝗼𝗺𝗽𝗿𝗮 a la hora de elegir agentes de código. La empresa busca socios para llevar esa cifra a modelos de frontera, y ahí es donde tendrá que demostrarse.\n\n#UnrealAgent #Codex #DevTools\n\nhttps://unreallabs.ai/blog/unreal-agent"
      }
    },
    {
      "rank": 6,
      "category": "lanzamientos",
      "title": "Rabbit vuelve con OS3, un agente de IA que no necesita su hardware",
      "summary": "Rabbit, la empresa del discreto R1, lanza OS3, un «agentic operating system» que corre en la nube pero opera sobre Windows, Mac y Linux locales. Permite asociar hasta cinco dispositivos a una cuenta y elegir los modelos de IA, y decide por su cuenta qué dispositivos, archivos y apps necesita para completar la tarea.",
      "why_it_matters": "El agente de Rabbit deja de depender de un gadget propio y se instala en los equipos que la gente ya tiene.",
      "url": "https://www.theverge.com/ai-artificial-intelligence/999094/rabbit-ai-agent-os3",
      "source": "The Verge",
      "social": {